TYPE,CLASS,text,line,start_pos,end_pos,file,class0,U,"Description On July 31 at approximately 1:09 A.M., the control room foreman defeated the primary plant computer system's (PPCS) alarm point OT405DEV in response to repeated activations that he thought was due to maintenance.",186,543,767,ginn_2002005.txt,10,U,The alarming condition was not investigated nor documented on an Action Report and resulted in a missed opportunity to identify the improperly calibrated OTDT channels sooner (see section R22).,186,767,960,ginn_2002005.txt,00,U,"The PPCS alarm point remained defeated until identified during the weekly PPCS alarm check performed on August 16, per O-6.11, ""Surveillance Requirement/Routine Operations Check Sheet.""",186,960,1145,ginn_2002005.txt,00,U,"The failure to identify and question the defeated alarm during the prior weekly check on August 6, comprised a second missed opportunity.",186,1145,1282,ginn_2002005.txt,00,U,"Upon restoration, the alarm continued to activate and Action report 2002-1877 was generated leading to the ultimate discovery that the OTDT lead-lag circuits for channels 1 and 4 had been improperly calibrated.",186,1282,1492,ginn_2002005.txt,01,T,"On March 11, 2002, Action Report 2002-0454 was issued in response to the operators failure to identify that the 11B under voltage relays had tripped.",186,1492,1641,ginn_2002005.txt,00,U,A PPCS alarm had indicated the failure but was felt to be invalid based on a visual inspection of the relays.,186,1641,1750,ginn_2002005.txt,00,U,"The alarm was valid, but the visual inspection was not.",186,1750,1805,ginn_2002005.txt,00,U,The operations manager counseled the operators to regard all PPCS alarms with the same intensity and rigor as would be given a main control board alarm.,186,1805,1957,ginn_2002005.txt,10,U,"On October 16, 2001, Action Report 2001-1805, identified that a loss of the ATWAS Mitigation System and Circuitry had not been identified as a result of the accompanying PPCS alarms significance not being understood or investigated.",186,1957,2189,ginn_2002005.txt,00,U,A long term action to evaluate the nomenclature of the PPCS alarms and discussions with the operating shifts on expectations and maintaining a questioning attitude was the stated corrective action.,186,2189,2386,ginn_2002005.txt,00,U,"16 Analysis This issue was considered greater than minor since inadequate or poor response to primary plant computer alarms could be reasonably viewed a precursor to a significant event or, if left uncorrected, could become a more significant safety concern.",188,0,259,ginn_2002005.txt,00,U,"The finding is not suitable for SDP evaluation, but has been reviewed by NRC management and determined to be a green finding of very low safety significance, however, not a violation of a regulatory requirement.",188,259,470,ginn_2002005.txt,00,U,Enforcement No violation of regulatory requirements occurred.,188,470,531,ginn_2002005.txt,00,U,OA6 a.,188,531,537,ginn_2002005.txt,00,U,"Meetings Exit Meeting Summary On October 8, 2002, the inspectors presented their overall findings to members of RG&E management led by Joe Widay.",188,537,682,ginn_2002005.txt,00,U,RG&E management acknowledged the findings presented.,188,682,734,ginn_2002005.txt,00,U,No proprietary information was identified.,188,734,776,ginn_2002005.txt,00,U,"c. RG&E/NRC Management Meeting On August 19, 2002, Mr. Miller, Administrator NRC Region 1 and Ms. Evans, Chief, Reactor Projects Branch 1, conducted a tour of the Ginna facility and met with senior plant managers and station personnel.",188,776,1011,ginn_2002005.txt,00,U,"On August 20, 2002, NRC Chairman Richard Meserve, accompanied by Mr. Miller, conducted a tour of the Ginna facility and met with senior plant managers and station personnel.",188,1011,1184,ginn_2002005.txt,00,U,"OA7 a. Licensee-identified Violation Inspection Scope The following violation of very low safety significance (Green) was identified by the licensee and is a violation of NRC requirements which meets the criteria of Section VI of the NRC Enforcement Policy, NUREG-1600, for being dispositioned as a Non-Cited Violation (NCV): The licensee conducted a site wide survey to identify contaminated tools and other equipment that were improperly surveyed prior to being removed from radiologically controlled areas (RCA) for storage at other site locations.",188,1184,1735,ginn_2002005.txt,00,U,"The results of this survey identified items that were not properly surveyed prior to removal from the RCA, as described in the corrective action program Action Report 2001-2107.",188,1735,1912,ginn_2002005.txt,00,U,Failure to make proper surveys prior to removal of equipment from the RCA is contrary to 10 CFR 20.1501.,188,1912,2016,ginn_2002005.txt,00,U,"Since the contaminated equipment was promptly returned to the RCA and no material was released into the public domain, this violation is of very low safety significance and is being treated as a non-cited violation.",188,2016,2231,ginn_2002005.txt,00,U,17,190,0,3,ginn_2002005.txt,00,U,18 Attachment 1 Supplemental Information a.,192,0,44,ginn_2002005.txt,00,U,Key Points of Contact RG&E G. Ball P. Bamford J. Bement K. Cona M. Flaherty K. Gould N. Leoni F. Mis P. Perry P. Polfleit R. Popp J. Smith J. St. Martin W. Thomson R. Watts J. Wayland T. White J. Widay B.,192,44,248,ginn_2002005.txt,00,U,Wood b.,192,248,255,ginn_2002005.txt,00,U,"Technician, Respiratory Protection Operations Manager Foreman, Radiation Protection Operations System Engineer, Radiation Monitoring Instrumentation Nuclear Safety and Licensing Manager Senior Health Physicist Quality Assessment Coordinator, Radiation Protection Chemistry Manager Systems Engineer, Radwaste Corporate Emergency Planner Production Superintendent Maintenance Superintendent Licensing Engineer Manager, Radiation Protection Nuclear Training Department Manager I&C/Electrical Maintenance Manager Balance of Plant Engineering Manager VP, Plant Manager Technician, Radiation Instrument Calibration",192,255,863,ginn_2002005.txt,00,U,"List of Items Opened, Closed, and Discussed Opened NCV 50-244/02-05-01, (Green) RG&E failed to maintain the procedure that described the steps for combating a fire in the screenhouse as required by technical specification 5.4.1.d.",194,0,230,ginn_2002005.txt,00,U,"(Green) RG&E failed to provide and follow appropriate instructions for the calibration of the OTDT lead-lag circuit as required by 10 CFR 50, Appendix B, Criterion V, Instructions, Procedures, and Drawings.",194,230,436,ginn_2002005.txt,00,U,"NCV 50-244/02-05-02,",196,0,20,ginn_2002005.txt,00,U,Attachment 1 (cont'd) c. List of Documents Reviewed,198,0,52,ginn_2002005.txt,00,U,19,200,0,2,ginn_2002005.txt,00,U,"O-6.13, Daily Surveillance Log RP-RES-M-RESP, Rev 4, Maintenance and Care of Respirators RPA-RES-GEN, Rev 5, Use of Respiratory Protection Equipment - General Requirements SC-3.16.15.1, Rev 9, Charging of 4.5 Units Using the Breathing Air Compressor CPI-MON-R2/R9, Rev 18, Calibration of Area Monitor Radiation Monitoring System Channels R-2 through R-9 PT-17.1, Rev 45, Area Radiation Monitors - R1 to R9 RP-INS-C-TELESCAN, Rev1, Calibration of Xetec Model 330A Telescan RP-JC-PCM-SRC-CHKS, Rev 1, Quality Control of Eberline PCM RP-INS-C-SAM, Rev 0, Calibration of the N. E. Technology Small Article Monitor RP-JC-SAM, Rev 0, Operation of the N. E. Technology Small Article Monitor RP-JC-PCM-SRC-CHKS, Rev 1, Quality Control of Eberline PCM RP-JC-AIRSAMPLE, Rev 9, Operation of Portable Air Sampling Equipment RP-INS-O-MODEL89, Rev 2, Shepard Model 89 Calibrator Operation RP-SUR-SOURCE-USE, Rev 3, Radioactive Source Use RP-JC-DAILY-SRC-CHKS, Rev 14, Daily Instrument Source Checks RP-INS-C-RAD51, Rev 5, Calibration of RADOS Electronic Dosimeter PT-2.8Q, Component Cooling Water Pump Quarterly Test A-905, Open Flame, Welding and Grinding Permit PT-12.1, Emergency Diesel Generator ""A"" SC-3.2.11, Immediate Action- Screenhouse Fire SC-3.15.17, TRM Firewatch Posting IP-PSH-2, Integrated Work Schedule Risk Management IP-REL-5, 10 CFR 50.65(a)4 Program PT-2.7.1, Service Water Pumps PT-2.3 Safeguard Power Operated Valve Operation A-52.16, Operator Work Around Challenge Control SM-2000-042.1, Modification of Containment Narrow Range Pressure Transmitter Loop 944 A-25.7, Bypass of I&C/Electrical Function and Jumper Control on out of Service Equipment PT-13.11.8, Testing of Smoke Detection Zone Z-37 Intermediate Building - North Service Water System Reliability Optimization Program (SWSROP) (Rev.",202,0,1804,ginn_2002005.txt,10,U,"4) Spring 2002 Outage Report, ""Underwater Inspection of Intake Structure and Screen house Mechanical Equipment.""",202,1804,1916,ginn_2002005.txt,00,U,RG&E Report No.,202,1916,1931,ginn_2002005.txt,00,U,"B-13-387, ""Rochester Gas & Zebral Mussel Control Program for Ginna Station 2001 PT-60.6A, (Rev 2), CCW Heat Exchanger Performance Test Performance Monitoring Data Trending Reports A & D CRFCs DA-ME-2002-028 (Rev 0), CCW Heat Exchanger A & B Thermal Performance Testing Data Reduction, Fouling, and Uncertainty Analysis (Test Date 3/18/2002).",202,1931,2272,ginn_2002005.txt,00,U,DA-ME-97-016 (Rev.,202,2272,2290,ginn_2002005.txt,00,U,"0), CCW and RHR Heat Exchanger Performance Evaluation SWSROP (GL 89-13) Heat Exchanger Testing Generic Assumptions, Data Reduction and Methodology, and Fouling Determination DA-ME-2000-074 (Rev 0), Component Cooling Water Heat Exchanger A & B Thermal Performance Testing Data Reduction, Fouling, and Uncertainty Analysis.",202,2290,2611,ginn_2002005.txt,00,U,Attachment 1 (cont'd),204,0,22,ginn_2002005.txt,00,U,20,206,0,2,ginn_2002005.txt,00,U,"O-6.13, Daily Surveillance Log W.O.",208,0,35,ginn_2002005.txt,00,U,"20101393, CNMT Recirc Fan Cooling Coil C Open/Inspect for Fouling W.O.",208,35,105,ginn_2002005.txt,00,U,"20101394, CNMT Recirc Fan Cooling Coil D Open/Inspect for Fouling.",208,105,171,ginn_2002005.txt,00,U,"CMP-10-07-RECIRCFANC (Rev.01), Mario, Model 12Q, Cooling Coil Inspection and Maintenance for ACA01c, ACA01J, and ACA01K.",208,171,291,ginn_2002005.txt,00,U,"CMP-10-07-RECIRCFAND (Rev.01), Mario, Model 12Q, Cooling Coil Inspection and Maintenance for ACA01C, ACA01J, and ACA01K.",208,291,411,ginn_2002005.txt,00,U,W.O.,208,411,415,ginn_2002005.txt,00,U,"20100875, EDG A Clean/Inspect Jacket Water / Lube Oil Coolers W.O.",208,415,481,ginn_2002005.txt,00,U,"20100876, EDG B Clean/Inspect Jacket Water/ Lube Oil Coolers CMP-10-04EAC01B (Rev.",208,481,563,ginn_2002005.txt,00,U,"02), Atlas Industrial Manufacturing, Type NEN Heat Exchanger Maintenance for EACO1B.",208,563,647,ginn_2002005.txt,00,U,CMP-10-04EAC01B (Rev.,208,647,668,ginn_2002005.txt,00,U,"02), Atlas Industrial Manufacturing, Type NEN Heat Exchanger Maintenance for EACO1B.",208,668,752,ginn_2002005.txt,00,U,CMP-10-03-ESW09A(Rev.,208,752,773,ginn_2002005.txt,00,U,"02), American Standard, Model 1205CP Heat Exchanger Maintenance for ESW09A.",208,773,848,ginn_2002005.txt,00,U,CMP-10-03-ESW08A (Rev.,208,848,870,ginn_2002005.txt,00,U,"02), American Standard, Model 1205-6, CP Heat Exchanger Maintenance for ESW08A.",208,870,949,ginn_2002005.txt,00,U,CMP-10-03-ESW09B (Rev.,208,949,971,ginn_2002005.txt,00,U,"01), American Standard, Model 1206, CP Heat Exchanger Maintenance for ESW09B.",208,971,1048,ginn_2002005.txt,00,U,CMP-10-03-ESW08B (Rev.,208,1048,1070,ginn_2002005.txt,00,U,"01), American Standard, Model 1205-6, CP Heat Exchanger Maintenance for ESW08B.",208,1070,1149,ginn_2002005.txt,00,U,W.O.,208,1149,1153,ginn_2002005.txt,00,U,"20100493, CCW A Heat Exchanger Clean/Inspect & Perform Eddy Current Testing W.O.",208,1153,1233,ginn_2002005.txt,00,U,"20100913, CCW B Heat Exchanger Clean/Inspect & Perform Eddy Current Testing EPIP 1-5, Notifications, Rev 50 EPIP 1-6, Site Evacuation, Rev 14 EPIP 1-10, Operation Support Center (OSC) Activation, Rev 11 EPIP 1-11, Survey Center Activation, Rev 27 EPIP 1-18, Discretionary Actions for Emergency Conditions, Rev 4, 5 EPIP 2-7, Management of Emergency Survey Teams, Rev 11 EPIP 2-9, Administration of Potassium Iodine (KI), Rev 6 EPIP 2-10, In Plant Radiation Surveys, Rev 4 EPIP 3-1, Emergency Operation Facility (EOF) Activation, Rev 18 EPIP 3-2, Engineering Support Center Activation (ESC), Rev 10 EPIP 5-1, Offsite Emergency Response Facilities and Equipment Periodic Inventory Check and Tests, Rev 26 EPIP 5-2, Onsite Emergency Response Facilities and Equipment Periodic Inventory Check and Tests, Rev 28, 29 EPIP 5-7, Emergency Organization, Rev 38 Calibration Records Shepard Model 142-10 Calibration Shepard Model 28 Calibration Shepard Model 89 Calibration Xetec Model 330A Telescan Tennelec S5E (Serial No.",208,1233,2246,ginn_2002005.txt,00,U,76672) Tennelec S5E (Serial No.,208,2246,2277,ginn_2002005.txt,00,U,75331),208,2277,2283,ginn_2002005.txt,00,U,Attachment 1 (cont'd),210,0,22,ginn_2002005.txt,00,U,21,212,0,2,ginn_2002005.txt,00,U,Tennelec S5E (Serial No.,214,0,24,ginn_2002005.txt,00,U,LB5100-W) Whole Body Counter (Fastscan) Calibration Electronic Dosimeter Calibration (Serial Nos.,214,24,121,ginn_2002005.txt,00,U,"991726, 991731, 992064) Area Monitor, Containment, R-2 Area Monitor, Charging Pump Room, R-4 Area Monitor, Letdown Line, R-9 Eight (8) Management Observation of Training Records - SCBA training Mask Qualification List Control Room Staffing List for July 24, 2002 Modifications PCR 2001-0016 PCR 99-010 PCR 98-046 PCR 2000-0024 PCR 2000-0033 PCR 2001-0024 PCR 2002-0006 PCR 2002-0008 PCR 2002-0010 PCR 99-045 SI Pump Discharge Check Valves 878G & 878J Replacement, Revision 0 Replace Relieve Valves 9709A and 9709B with a New Style Crosby Relieve Valve, Revision 0 Raise Set Pressure of RV 887, Revision 0 CR HVAC Replacement - Rev.",214,121,752,ginn_2002005.txt,10,U,"0 is Electrical 2002 Outage Scope DC Control, Revision 0 Replacement of Stop-Check Valve 9633A and 9633B with a Globe Stop Valve, Revision 0 Control Rod Drive Cabinet Cooling Modification, Revision 0 MCC ""C"" Molded Case Circuit Breaker Replacements - 2002 Outage, Revision 0 Instrument Buses A, B, and C Replacement, Revision 0 Power Supply Connection at MOV 515, Revision 0 Convert Delta T Voltage Loop to A Current Loop, Revision 0",214,752,1185,ginn_2002005.txt,10,U,"Setpoint Change Packages SPCR 2002-0008 Revision 0 SPCR 2002-0012 Secure One RHR Pump When Flow Less Than 1200 gpm, Anticipatory Manual Reactor Trip at 20% Steam Generator Level with Steam Flow Greater than Feedwater Flow, Revision 0",216,0,233,ginn_2002005.txt,00,U,"10 CFR 50.59 Safety Evaluations SE-2002-0001 SE-2001-0004 SE-2001-0005 SI Pump Discharge Check Valves 878G & 878J Replacement, Revision 0 Control Rod Drive Cabinet Cooling Modification, Revision 0 Pneumatic Controls Modification to Allow Fresh Air into Control Room, Revision 0.",218,0,278,ginn_2002005.txt,10,U,Attachment 1 (cont'd) 10 CFR 50.59 Screen-out Evaluations 2001-0156 2002-0239 99-010 98-046 20011-0206 2002-0290 99-045 2001-0151 2001-0030 2001-0208 2001-0266 2002-0070 2002-0160 2002-0310 2002-0335 No unique number,220,0,217,ginn_2002005.txt,00,U,22,222,0,2,ginn_2002005.txt,00,U,"SI Pump Discharge Check Valves 878G & 878J Replacement, Revision 1 System Flow Below Which Two RHR Pumps Should Not Be Operated With the Discharge Crosstie Valve Open, Revision 0 Replace Relieve Valves 9709A and 9709B with a New Style Crosby Relieve Valve, Revision 0 Raise Set Pressure of RV 887, Revision 1 Instrument Buses A, B, and C Replacement, Revision 0 Power Supply Connection at MOV 515, Revision 0 Convert Delta T Voltage Loop to A Current Loop, Revision 0 Containment Spray Jumper Installation for Use During a Loss of MQ-483 Control Rod Drive Cabinet Fans, Revision 0 Control Rod Drive Cabinet Cooling Modification, Revision 0 Control Room HVAC - Install 2 New Trains of CREATS & Emergency Cooling, Revision 0 Add Attachment 7 to PCR 2001-0024, Revision 0, Basis for Control Rod Cabinet High Temperature Alarm Setpoint MCCC Molded Case Circuit Breaker Replacements - 2002 Outage, Revision 0 Install Light Behind Control Rod Drive Cabinet Air Distribution Inside Rod Control Cabinets Replacement of Stop-Check Valve 9633A and 9633B with a Globe Stop Valve, Revision 0",224,0,1079,ginn_2002005.txt,10,U,Self-Assessments SA 2001-0016 SA 2001-0035 SA 2002-0001 AINT-2000-0010-TJD SA 2001-0012 Change Impact Evaluation Form (CIE) Usage Design Process Review of PCR 2000-0019 Revision 1 Implementation of the Revised 10 CFR 50.59 Rule Requirements.,226,0,241,ginn_2002005.txt,10,U,"Radwaste Shipping /Process Control Program Audit, February 9, 2001 Assessment of RP Instrumentation Program for Equipment Upgrades",226,241,371,ginn_2002005.txt,10,U,"Action Reports AR 2000-1222 AR 2001-0686 AR 2001-1297 AR 2002-0771 AR 2001-0642 Changes to Facility SSCs That May Impact Permits, Need to be implemented into the PCR Process Unexpected MCB Alarms received during holding of Protection Channel 2 for PCR 99-045 Inadequate Procedural Guidance Following R-15A Modification 50.59 Applicability Determination Enhancements Received Alarm C-30 While Inserting Rods in Manual",228,0,416,ginn_2002005.txt,10,U,Attachment 1 (cont'd) AR 2001-0651 AR 2001-1585 AR 2001-1642 AR 2002-0286 AR 2002-1146 AR 2002-2155 AR 2002-2156 AR 2002-2157 AR 2001-0609 AR 2002-0093 AR 2001-1640 AR 2001-1929 AR 2002-2042 AR 2002-1762 AR 2002-1809 AR 2002-1997 AR 2002-2044 AR 2002-2110 Procedures IP-DES-2 IP-DES-4 IP-SEV-1 IP-SEV-2 IP-LPC-7,230,0,312,ginn_2002005.txt,00,U,"23 Fire Door 37 Opened as a Compensatory Action for Control Rod Cabinets without a 50.59 Evaluation [related to PCR 2001-0024] UFSAR Not Completely Updated Following MRPI Modification Attention to Detail Deficiencies Associated with Plant Modifications Operations Procedures Implemented Prior to PCR Received MCB Alarm C-30 Urgent Failure Rod Stop, from Rod Control Cabinet 1BD Level of 50.59 Review for PCR 98-046 Questioned Control Room Turnover Sheet Wording, Associated with PCR 2001-0024 Procedure Updating Issues Associated with PCR 2001-0024 Found Monitor Tank a Level Control Pressure Switch inoperable during Performance of PCR 2000-0026 Error in Equipment Specification in PCR PCR 2000-0019, For MSIV Bypass Valves, Processing Deficiencies Compensatory Measure Implemented without 50.59 review Screenhouse Natural Gas Isolation Valve Location Indeterminate NUS Alarm Bistables Continually Blow Fuse During Calibration ""B"" D/G Bus 17 Supply Breaker Overcurrent Trip Damper Not Responding to Trip Signal AAD14 Water on top of ""B"" Condensate Storage Tank Diaphragm Z37D3E Failed Sensitivity Test",232,0,1102,ginn_2002005.txt,10,U,"Plant Change Process, Revision 16 Setpoint Change Process, Revision 2 Preparation, Review, & Approval of 50.59 Applicability Determinations and 50.59 Screens, Revision 9 Preparation, Review, & Approval of 50.59 Evaluations, Revision 11 Updated Final Safety Analysis Report Periodic & Continuous Updating, Revision 2",234,0,315,ginn_2002005.txt,1