TYPE,CLASS,text,line,start_pos,end_pos,file,class0,U,"еб AR 2001-0890, AOV Deficiencies.",134,161,194,ginn_2002005.txt,00,U,"This AR identified an inspector discovery that under certain conditions, two air operated valves in the auxiliary feedwater system, AOVs 4297 and 4298 would not fail open in the event actuating air was lost to the valves.",134,194,415,ginn_2002005.txt,10,U,"The engineering technical evaluation attached to AR 20010890 was reviewed to determine why the failure was not detected during IST activities, and to verify adequate corrective action had been implemented.",134,415,620,ginn_2002005.txt,00,U,"AR 2001-1468, Investigation of Ginna's Containment Structure's Tendon System Grease Leakage.",134,620,712,ginn_2002005.txt,00,U,This AR documented the results of an RG&E discovery that grease was leaking from the containment tendons.,134,712,817,ginn_2002005.txt,00,U,The engineering technical evaluation was reviewed to verify RG&E had implemented adequate corrective action to monitor level of grease in the containment tendons.,134,817,979,ginn_2002005.txt,00,U,"WO 20202, Vital Battery Monitor ""B.""",134,979,1015,ginn_2002005.txt,00,U,"This work order was initiated to bypass spurious control room alarms that were occurring on the ""B"" vital battery monitor.",134,1015,1137,ginn_2002005.txt,10,U,The inspectors reviewed the work instructions that disabled the control room annunciator and verified the instructions were adequate to perform the activity.,134,1137,1294,ginn_2002005.txt,10,U,"AR 2002-2055, Water on top of ""B"" Condensate Storage Tank Diaphragm.",134,1294,1362,ginn_2002005.txt,00,U,"This AR documented a licensee discovery that water had collected on top of the rubber diaphragm located in the ""B"" Condensate Water Storage Tank, which is an indication that the internal tank diaphragm had failed.",134,1362,1575,ginn_2002005.txt,00,U,"RG&E had examined the tank in response to a recent industry event, where a diaphragm failure rendered an auxiliary feedwater pump inoperable.",134,1575,1716,ginn_2002005.txt,00,U,"The inspector reviewed an engineering evaluation that evaluated the condition to verify adequate compensatory action was implemented, and the safety significance of the discovery had been adequately assessed.",134,1716,1924,ginn_2002005.txt,00,U,еб,136,0,1,ginn_2002005.txt,00,U,еб,138,0,1,ginn_2002005.txt,00,U,еб,140,0,1,ginn_2002005.txt,00,U,This inspection included discussion with plant personnel and reviews of applicable technical specifications and design bases information.,142,0,137,ginn_2002005.txt,00,U,b.,142,137,139,ginn_2002005.txt,00,U,Findings No findings of significance were identified.,142,139,192,ginn_2002005.txt,00,U,7 R16 a.,144,0,9,ginn_2002005.txt,00,U,"Operator Workarounds Inspection Scope The inspectors reviewed the cumulative effects of Ginna's existing operator workarounds/challenges, control room deficiencies, and degraded but operable equipment.",144,9,210,ginn_2002005.txt,00,U,The inspection focused on the overall impact to plant systems and operator event response capability.,144,210,311,ginn_2002005.txt,00,U,"Ginna procedure A-52.16, ""Operator Workaround/Challenge Control,"" technical specifications, system design information, and corrective action program records were referenced.",144,311,484,ginn_2002005.txt,00,U,The inspectors also looked for potential operator workarounds/challenges not formally evaluated by RG&E.,144,484,588,ginn_2002005.txt,00,U,b.,144,588,590,ginn_2002005.txt,00,U,Findings No findings of significance were identified.,144,590,643,ginn_2002005.txt,00,U,R17 a.,144,643,649,ginn_2002005.txt,00,U,"Permanent Plant Modifications Inspection Scope Biennial Inspection The inspectors selected and reviewed ten risk-significant plant modification packages and two set point change packages to verify that: (1) the design bases, licensing bases, and performance capability of risk significant Structures, Systems or Components had not been degraded through modifications and set point changes; and, (2) modifications and set point changes performed during increased risk configurations did not place the plant in an unsafe condition.",144,649,1178,ginn_2002005.txt,10,U,The modification and set point change packages were selected from among the design changes that were closed within the past two years.,144,1178,1312,ginn_2002005.txt,10,U,"The plant modifications and set point changes were distributed among initiating event, mitigating system, and barrier integrity cornerstones.",144,1312,1453,ginn_2002005.txt,00,U,"For these modifications and set point changes, to determine design adequacy, the inspectors reviewed the design inputs, assumptions, and design calculations, such as an instrument set point, instrument uncertainty, and electrical loading calculations.",144,1453,1704,ginn_2002005.txt,10,U,The inspectors also reviewed field change notices that were issued during the installation to confirm that the problems associated with the installation were adequately resolved.,144,1704,1882,ginn_2002005.txt,00,U,"In addition, the inspectors reviewed the post-modification testing, functional testing, and instrument calibration records to determine readiness for operations.",144,1882,2043,ginn_2002005.txt,00,U,"Finally, the inspectors reviewed the affected procedures, drawings, design basis documents, and Updated Final Safety Analysis Report sections to verify that the affected documents were appropriately updated.",144,2043,2250,ginn_2002005.txt,10,U,"For the accessible components associated with the modifications, the inspectors also walked-down the systems to detect possible abnormal installation conditions.",144,2250,2411,ginn_2002005.txt,00,U,The listing of the reviewed modifications and set point changes is provided in Attachment 1.,144,2411,2503,ginn_2002005.txt,00,U,"8 Annual Inspection The inspectors reviewed SM-2000-042.1, Modification of Containment Narrow Range Pressure Transmitter Loop 944. b.",146,0,134,ginn_2002005.txt,00,U,Findings No findings of significance were identified.,146,134,187,ginn_2002005.txt,00,U,R19 a.,146,187,193,ginn_2002005.txt,00,U,Post Maintenance Testing Inspection Scope The inspectors reviewed the post maintenance tests for the following work orders (WO) to verify that RG&E appropriately demonstrated the components' ability to perform their intended safety function.,146,193,434,ginn_2002005.txt,00,U,"еб еб еб еб еб еб WO 20101892, installation of a new quick disconnect on penetration 305D.",146,434,518,ginn_2002005.txt,00,U,"Tested per PTT-23; ""Containment Isolation Valve Leak Rate Testing,"" WO 20103993, periodic lubrication of service water system valves.",146,518,651,ginn_2002005.txt,00,U,"Tested per PT-2.3; ""Safeguard Power Operated Valve Isolation.""",146,651,713,ginn_2002005.txt,00,U,"WO 20103246, replace an N-38 drawer lower section defeat selector switch.",146,713,786,ginn_2002005.txt,00,U,"WO 20202331, troubleshoot the G auxiliary building fan.",146,786,841,ginn_2002005.txt,00,U,"AR 2002-2110, ""Smoke Detector Z37D3E Failed Sensitivity Test.",146,841,902,ginn_2002005.txt,00,U,"Tested per PT-13.11.8, ""Testing of Smoke Detector Zone Z-37 Intermediate Building North.""",146,902,991,ginn_2002005.txt,00,U,"WO 20100679, perform PM Inspection on ""A"" Component Cooling Water Pump Breaker (52/CCP1A).",146,991,1081,ginn_2002005.txt,00,U,b.,148,0,2,ginn_2002005.txt,00,U,Findings No findings of significance were identified,150,0,52,ginn_2002005.txt,00,U,"9 R22 a. Surveillance Testing Inspection Scope The inspectors witnessed the performance and/or reviewed test data for the following activities to verify that the tests met the requirements of the plant technical specifications, and demonstrated the associated system's functional capability, and operational readiness.",152,0,319,ginn_2002005.txt,00,U,The inspectors reviewed samples of prior test performance results on the selected equipment to verify that degraded or non-conforming conditions were identified and corrected.,152,319,494,ginn_2002005.txt,00,U,"еб еб еб еб еб еб еб CPI-FLO-2015A, ""Calibration of the Turbine Driven Auxiliary Feedwater Pump Discharge Flow Loop 2015A.""",152,494,610,ginn_2002005.txt,00,U,"PT-36Q-C, ""Standby Auxiliary Feedwater Pump C - Quarterly.""",152,610,669,ginn_2002005.txt,00,U,"PT-12.1, ""Emergency Diesel Generator A.""",152,669,709,ginn_2002005.txt,00,U,"PT-12.2, ""Emergency Diesel Generator B.""",152,709,749,ginn_2002005.txt,00,U,"PT-2.8Q, ""Component Cooling Water Quarterly Test.""",152,749,799,ginn_2002005.txt,00,U,"CPI-SP1-405.10, ""Calibration of Delta T Set point 1 Over temperature Channel 1,"" performed on July 29 and August 20, 2002.",152,799,921,ginn_2002005.txt,00,U,"CPI-SP1-408.10, ""Calibration of Delta T Set point 1 Over temperature Channel 4,"" performed on February 16 and August 21, 2002.",152,921,1047,ginn_2002005.txt,00,U,b.,154,0,2,ginn_2002005.txt,00,U,Findings OTDT Calibration Errors Introduction Green.,156,0,52,ginn_2002005.txt,01,O,"The inspectors identified RG&E failed to provide and follow appropriate instructions for the calibration of the OTDT lead-lag circuit as required by 10 CFR 50, Appendix B, Criterion V, Instructions, Procedures, and Drawings.",156,52,276,ginn_2002005.txt,00,U,"Description During the weekly computer checks on August 16 the on-shift control room foreman discovered computer point OT405DEV was set to ""Alarm Processing set off.""",156,276,442,ginn_2002005.txt,10,U,"When the point was enabled, repeated alarm activations occurred.",156,442,506,ginn_2002005.txt,00,U,This condition was documented in (AR 02-1877).,156,506,552,ginn_2002005.txt,00,U,"Re-calibration of channel 1, to resolve what was suspected to be a noisy channel input, identified the lead-lag circuit had been improperly set.",156,552,696,ginn_2002005.txt,00,U,"A check on August 20th of the remaining three channels, an identified channel 4's lead-lag circuit had also been mis-calibrated.",156,696,824,ginn_2002005.txt,00,U,"Channels 1 and 4 were last calibrated on July 29 and February 16, 2002, respectively.",156,824,909,ginn_2002005.txt,00,U,A proper calibration of the OTDT lead-lag module requires strip-chart data be properly obtained and correctly interpreted.,156,909,1031,ginn_2002005.txt,00,U,"The shape of the lead-lag output curve, shown to be highly dependent on the setting of the test equipment's ramp generator time dial, must be proper to obtain valid results from the data analysis.",156,1031,1227,ginn_2002005.txt,00,U,"Because the surveillance test equipment was not properly set up, data plots obtained during the February and July calibrations of channels 1 and 4 were invalid, though not recognized as such.",156,1227,1418,ginn_2002005.txt,00,U,Though,156,1418,1424,ginn_2002005.txt,00,U,"10 data analysis appeared to show the channels within TS requirements, they in fact were out of specification in a conservative direction by approximately 20 and 5 seconds respectively.",158,0,186,ginn_2002005.txt,00,U,Review of the applicable calibration procedures identified that inadequate guidance existed to ensure that valid data would be obtained.,158,186,322,ginn_2002005.txt,00,U,"In addition, deficient and outdated instructions were found present.",158,322,390,ginn_2002005.txt,00,U,The inspectors determined the technicians lack of procedural adherence and their acceptance of the deficient procedure during this and prior calibrations contributed to the error.,158,390,569,ginn_2002005.txt,00,U,"Analysis This finding affected the Mitigating System Cornerstone and was determined to be more than minor in accordance with MC 0612, Appendix E because improper calibration of reactor protection circuitry could cause an unnecessary plant transient.",158,569,818,ginn_2002005.txt,00,U,"However, the error was conservative and did not cause a loss of safety function and therefore screened as Green when evaluated in accordance with the SDP, MC-0609.",158,818,981,ginn_2002005.txt,00,U,"Enforcement The finding was determined to be a violation of 10 CFR 50, Appendix B, Criterion V, Instructions, Procedures, and Drawings, which requires in part that activities affecting quality be prescribed and accomplished in accordance with appropriate procedures.",158,981,1247,ginn_2002005.txt,01,O,RG&E failed to provide and follow appropriate instructions for the calibration of the OTDT lead-lag circuit.,158,1247,1355,ginn_2002005.txt,00,U,"However, because of the very low safety significance of this violation and because RG&E has entered the issue into their corrective action program (AR 2002-1877) this violation is being treated as a non-cited violation, in accordance with Section VI.A.1 of the NRC's Enforcement policy.",158,1355,1641,ginn_2002005.txt,00,U,(NCV 50-244/02-05-02) Improper EDG Output Breaker Operation Introduction Green.,158,1641,1720,ginn_2002005.txt,01,H,"Operator error during performance of surveillance test PT-12.2, ""Emergency Diesel Generator B,"" resulted in the ""B"" diesel generator being rendered inoperable for approximately seven hours.",158,1720,1909,ginn_2002005.txt,00,U,The finding was determined to be of very low safety significance.,158,1909,1974,ginn_2002005.txt,00,U,"Description On August 6, 2002, during the performance of PT-12.2 ""Emergency Diesel Generator B,"" the output breaker for the ""B"" diesel generator tripped when a control room operator attempted to parallel the diesel generator to bus 17.",158,1974,2209,ginn_2002005.txt,01,H,An RG&E review of the event concluded the breaker tripped because the operator had attempted to close the breaker when the diesel's electrical output was not in a phase with bus 17.,158,2209,2390,ginn_2002005.txt,00,U,"This action caused a high current to occur across the electrical contacts of the breaker, which resulted in the breaker trip.",158,2390,2515,ginn_2002005.txt,00,U,"As a result of this event, the diesel was rendered inoperable for approximately seven hours while troubleshooting was conducted on the diesel generator",158,2515,2666,ginn_2002005.txt,00,U,11 breaker for bus 17.,160,0,23,ginn_2002005.txt,00,U,"The diesel generator was restored to service when a spare breaker was installed in bus 17, and PT-12.2 was successfully completed.",160,23,153,ginn_2002005.txt,00,U,"The out of phase condition occurred when the operator was attempting to complete step 6.14 of PT-12.2 which states, in part, ""With the synchroscope rotating slowly in the FAST (clockwise) direction and approaching the 12 o'clock position, close the Diesel Generator supply breaker to the selected bus, such that the breaker closes at the approximate point of synchronization.""",160,153,529,ginn_2002005.txt,00,U,"When executing this step, the operator attempted to close the breaker when it was approximately five minutes before the 12 o'clock position.",160,529,669,ginn_2002005.txt,00,U,"This action was premature, which resulted in the breaker tripping.",160,669,735,ginn_2002005.txt,00,U,Analysis This finding affected the Mitigating Systems Cornerstone and had a credible impact on safety because it resulted in a risk significant component being rendered inoperable for seven hours.,160,735,931,ginn_2002005.txt,00,U,"The finding screened to Green in phase one of the SDP, Manual Chapter 0609, Appendix A, because the diesel was quickly returned to service following the breaker trip, and the remaining diesel generator and both offsite power sources were operable.",160,931,1178,ginn_2002005.txt,10,U,Enforcement No violation of regulatory requirements occurred.,160,1178,1239,ginn_2002005.txt,00,U,Emergency Preparedness [EP] EP4 a.,160,1239,1273,ginn_2002005.txt,00,U,Emergency Action Level and Emergency Plan Changes Inspection Scope The inspector conducted an in-office review of RG&E submitted changes for the emergency plan-related documents to determine if the changes decreased the effectiveness of the plan.,160,1273,1519,ginn_2002005.txt,10,U,"A thorough review was conducted of documents related to the risk significant planning standards (RSPS), such as classifications, notifications and protective action recommendations.",160,1519,1700,ginn_2002005.txt,00,U,A cursory review was conducted for non-RSPS documents.,160,1700,1754,ginn_2002005.txt,00,U,"These changes were reviewed against 10 CFR 50.54(q) to ensure that the changes did not decrease the effectiveness of the plan, and that the changes as made continue to meet the standards of 10 CFR 50.47(b) and the requirements of Appendix E. These changes are subject to future inspections to ensure that the impact of the changes continues to meet NRC regulations.",160,1754,2119,ginn_2002005.txt,00,U,The submitted and reviewed implementing procedures are listed in attachment one.,160,2119,2199,ginn_2002005.txt,00,U,12 b.,162,0,6,ginn_2002005.txt,00,U,Findings No findings of significance were identified.,162,6,59,ginn_2002005.txt,00,U,EP6 a.,162,59,65,ginn_2002005.txt,00,U,"Drill Evaluation Inspection Scope On August 12, 2002, the inspector observed a licensed operator training assessment that included an emergency activation level classification.",162,65,241,ginn_2002005.txt,00,U,Training scenario #ECA1112-10 was observed.,162,241,284,ginn_2002005.txt,00,U,The inspector verified that the appropriate emergency classification was identified and external notifications to responsible parties were simulated in a timely manner.,162,284,452,ginn_2002005.txt,00,U,b.,162,452,454,ginn_2002005.txt,00,U,Findings No findings of significance were identified.,162,454,507,ginn_2002005.txt,00,U,2,162,507,509,ginn_2002005.txt,00,U,RADIATION SAFETY Occupation Radiation Safety [OS] OS3 a.,162,509,565,ginn_2002005.txt,00,U,"Radiation Monitoring Instrumentation Inspection Scope During the period July 22 - 25, 2002, the inspector conducted the following activities to evaluate the operability and accuracy of radiation monitoring instrumentation, and the adequacy of the respiratory protection program, relative to maintaining and issuing selfcontained breathing apparatus (SCBA).",162,565,921,ginn_2002005.txt,00,U,"Implementation of these programs was reviewed against the criteria contained in 10 CFR 20, applicable industry standards, and the licensee's procedures.",162,921,1073,ginn_2002005.txt,00,U,"еб The inspector observed technicians performing radioactive source and functional checks on a variety of instruments including the whole body counter, portable survey instruments (RO-20), and contamination survey instruments (SAM-9, MS-3, RM-14).",162,1073,1319,ginn_2002005.txt,00,U,The inspector observed technicians calibrating a high range gamma survey meter (Xetec 330A Telescan).,162,1319,1420,ginn_2002005.txt,00,U,"The inspector reviewed the calibration records for selected electronic dosimeters, three gas flow proportional counters (Tennelec S5E), and area radiation monitors (R-02, R-04, and R-09).",162,1420,1607,ginn_2002005.txt,00,U,"The inspector reviewed the maintenance records, safety interlock checks, and current calibration source activity/dose rate determinations for the Shepard Model 89, Model 28, and Model 142-10 instrument calibrators.",162,1607,1821,ginn_2002005.txt,00,U,еб,164,0,1,ginn_2002005.txt,00,U,еб,166,0,1,ginn_2002005.txt,00,U,13 еб The inspector evaluated the adequacy of the respiratory protection program regarding the maintenance and issuance of self-contained breathing apparatus (SCBA).,168,0,165,ginn_2002005.txt,00,U,"Training and qualification records for licensed operators, radiation protection technicians, and fire brigade members required to wear SCBA's in the event of an emergency were reviewed.",168,165,350,ginn_2002005.txt,00,U,"Four (4) SCBA's, staged for use in the control room and at the Health Physics control point, were physically/functionally checked, and maintenance records for these SCBA's were reviewed.",168,350,536,ginn_2002005.txt,10,U,"The inspector evaluated the licensee's program for assuring quality in the radiation monitoring instrumentation and respiratory protection programs by reviewing a departmental self-assessment (SA 2001-0012), Management Observation of Training Reports for SCBA training, and fourteen (14) ACTION reports related to radiation instrumentation, SCBA's, and the monitoring of plant radiation levels to determine if problems were identified in a timely manner and appropriate corrective actions were taken to resolve the related issues.",168,536,1066,ginn_2002005.txt,00,U,еб,170,0,1,ginn_2002005.txt,00,U,b.,172,0,2,ginn_2002005.txt,00,U,Findings No findings of significance were identified.,174,0,53,ginn_2002005.txt,00,U,3,176,0,2,ginn_2002005.txt,00,U,SAFEGUARDS Physical Protection [PP],178,0,35,ginn_2002005.txt,00,U,PP3 a.,180,0,6,ginn_2002005.txt,00,U,Response to Contingency Events Inspection Scope The Office of Homeland Security (OHS) developed a Homeland Security Advisory System (HSAS) to disseminate information regarding the risk of terrorist attacks.,182,0,206,ginn_2002005.txt,00,U,The HSAS implements five color-coded threat conditions with a description of corresponding actions at each level.,182,206,319,ginn_2002005.txt,00,U,"NRC Regulatory Information Summary (RIS) 2002-12a, dated August 19, 2002, ""NRC Threat Advisory and Protective Measures System,"" discusses the HSAS and provides additional information on protective measures to licensees.",182,319,538,ginn_2002005.txt,00,U,"On September 10, 2002, the NRC issued a Safeguards Advisory to reactor licensees to implement the protective measures described in RIS 2002-12a in response to the Federal government's declaration of threat level ""orange.""",182,538,759,ginn_2002005.txt,00,U,"Subsequently, on September 24, 2002, the OHS downgraded the national security threat condition to ""yellow"" and a corresponding reduction in the risk of a terrorist threat.",182,759,930,ginn_2002005.txt,00,U,"The inspectors interviewed RG&E personnel and security staff, observed the conduct of security operations, and assessed RG&E's implementation of the threat level ""orange"" protective measures.",182,930,1121,ginn_2002005.txt,00,U,Inspection results were communicated to the region and headquarters security staff for further evaluation.,182,1121,1227,ginn_2002005.txt,00,U,14 b.,184,0,6,ginn_2002005.txt,00,U,Findings No findings of significance were identified.,184,6,59,ginn_2002005.txt,00,U,PP4 a.,184,59,65,ginn_2002005.txt,00,U,"Security Plan Changes Inspection Scope An in-office review was conducted of changes to the Physical Security Plan, identified as Revision U, submitted to the NRC on January 31, 2002, in accordance with the provisions of 10 CFR 50.54(p).",184,65,301,ginn_2002005.txt,10,U,"The review was conducted to confirm that the changes were made in accordance with 10 CFR 50.54(p), and did not decrease the effectiveness of the plan.",184,301,451,ginn_2002005.txt,10,U,b.,184,451,453,ginn_2002005.txt,00,U,Findings No findings of significance were identified.,184,453,506,ginn_2002005.txt,00,U,4,184,506,508,ginn_2002005.txt,00,U,OA1 a.,184,508,514,ginn_2002005.txt,00,U,OTHER ACTIVITIES [OA] Performance Indicator Verification Inspection Scope The inspector reviewed implementation of the Occupational Exposure Control Effectiveness Performance Indicator (PI) Program.,184,514,712,ginn_2002005.txt,00,U,"Specifically, the inspector reviewed Action Reports, and associated documents, for occurrences involving locked high radiation areas, very high radiation areas, and unplanned personnel exposures since the last inspection against the criteria specified in Nuclear Energy Institute (NEI) 99-02, Regulatory Assessment Performance Indicator Guideline, Revision 2, to verify that all occurrences that met the NEI criteria were identified and reported as Performance Indicators.",184,712,1184,ginn_2002005.txt,00,U,Accuracy of the safety system functional failure PI data for the period August 2001 to September 2002 was verified based on review of RG&E event reports.,184,1184,1337,ginn_2002005.txt,01,O,The inspectors also verified the completeness and accuracy of the safety system unavailability PI for the emergency alternating current (AC) power system for the second and fourth quarter of 2001 and second quarter of 2002.,184,1337,1560,ginn_2002005.txt,01,O,"The inspection was accomplished by discussion with plant personnel and review of unavailability tracking documentation, operator logs, action reports, work orders, and surveillance procedures.",184,1560,1752,ginn_2002005.txt,00,U,The inspector verified that an identified reporting error (AR 2002-2232) did not create a threshold change in the PI.,184,1752,1869,ginn_2002005.txt,00,U,Correction of the error is not necessary as the affected quarter will be dropped in the forthcoming submittal.,184,1869,1979,ginn_2002005.txt,00,U,15 b.,186,0,6,ginn_2002005.txt,00,U,Findings No findings of significance were identified.,186,6,59,ginn_2002005.txt,00,U,OA2 a.,186,59,65,ginn_2002005.txt,00,U,"Identification and Resolution of Problems Inspection Scope To evaluate RG&E's program for identifying and resolving problems, the inspectors reviewed various action reports during the course of this inspection that involved the mitigating system, and initiating event cornerstones.",186,65,346,ginn_2002005.txt,00,U,b.,186,346,348,ginn_2002005.txt,00,U,Findings Introduction Green.,186,348,376,ginn_2002005.txt,00,U,The inspectors identified that RG&E's prior corrective action for inadequate operator response to primary plant computer system (PPCS) alarms were not fully effective.,186,376,543,ginn_2002005.txt,0